{
  "schemaVersion": "R1I-INTERRUPTED-SERIAL-ATTEMPT-SEAL-v1",
  "sealId": "A8R-V2P1-INTERRUPTED-SERIAL-ATTEMPT-20260831-R1I-SEAL",
  "recordedAt": "2026-09-01T13:05:50.553801100+08:00",
  "sealingBaselineCommit": "1a453e6d05b6743abd0c3909c4a05bd35b2c15ff",
  "classification": "PASS-R1I-INTERRUPTED-SERIAL-ATTEMPT-EVIDENCE-SEALED",
  "sourceIncident": {
    "eventCommit": "b522f1a37814164dff18390ee23d5153d4499375",
    "terminalIdentity": "A8R-V2P1-INTERRUPTED-SERIAL-ATTEMPT-20260831",
    "terminalClassification": "INCONCLUSIVE-R0-HOST-SHUTDOWN-NO-CANONICAL-ARTIFACT",
    "report": {
      "path": "90_候选工作区/current/G0_全项目完成度与实验前暂停治理/03_R0_主运行因主机关机中断现场冻结报告.md",
      "sha256": "7f5acf8338f0621ecbe7ea262f4dce8444b9cd955ef79a843f08f0c3e0ad169f",
      "gitBlob": "26b656046cb2e4c9dce2f5e0793a21e4d800c1c0"
    },
    "machineEvidence": {
      "path": "90_候选工作区/current/G0_全项目完成度与实验前暂停治理/evidence/r0-host-shutdown-20260901.json",
      "sha256": "889eafc3a340f60d5d5743b64df086ab6b603ed9173465a54b62ef42542fb85c",
      "gitBlob": "0ddc30c6a3022c7454b6bb51cc0992e9da3baf92"
    },
    "machineEvidenceSidecar": {
      "path": "90_候选工作区/current/G0_全项目完成度与实验前暂停治理/evidence/r0-host-shutdown-20260901.sha256",
      "sha256": "0c322b87f2cd1e5148fe489598252095b9fa6dffdac73ba397d0ebcdf20a7539",
      "gitBlob": "7f7d8215765883fee049f09f705170b9a25f93e4"
    }
  },
  "pr1Decision": {
    "decisionId": "IYPT13-PR1-R0-HOST-SHUTDOWN-ROUTE-DECISION-v1",
    "commit": "0f8085b1fda43e4f83d5152cfd99294bc3c0fc29",
    "path": "90_候选工作区/current/G0_全项目完成度与实验前暂停治理/04_PR1_串行参考关机中断与硬件路线接续裁决.md",
    "sha256": "65f964ea9973c688b1d16b517808fb45efaab75fb74f16e734977cd5c2203aee",
    "gitBlob": "7f960f8a32849736532766c972f6ab4bdb0187d8"
  },
  "oldWorktree": {
    "path": "/home/cjt/Desktop/iypt/13 涡流摆",
    "realpath": "/home/cjt/Desktop/iypt/13 涡流摆",
    "device": 66310,
    "inode": 815894,
    "directorySizeBytes": 4096,
    "branch": "main",
    "head": "88c4e9e8ba57b02a06315679e9b30dd10999b30c",
    "upstream": "origin/main",
    "localOriginMain": "0c44ad25fecd82423e26fb7d6ff8dadd52d67eee",
    "ahead": 0,
    "behind": 21,
    "porcelainV2Entries": [],
    "clean": true,
    "originNetworkRefreshPerformedDuringR1i": false,
    "optionalGitLocksDisabled": true,
    "currentBootId": "e1a15398-1406-40c7-b8d5-c04ef5a7b282",
    "currentBootStartedAt": "2026-09-01T12:37:37+08:00",
    "disposition": "READ_ONLY_HISTORICAL_ARCHIVE_IN_PLACE",
    "mutatingCommandsExecuted": [],
    "reuseForbiddenFor": ["H1", "H2", "HW1-primary", "HW1-repeat"]
  },
  "processes": [
    {"pid": 51467, "role": "npm", "state": "ABSENT"},
    {"pid": 51497, "role": "shell-wrapper", "state": "ABSENT"},
    {"pid": 51498, "role": "node-runner", "state": "ABSENT"}
  ],
  "artifacts": {
    "expectedGzip": {
      "path": "90_候选工作区/current/A8_二维特征开放边界实验后端/验证与复现/artifacts/a8-brinkman-cycle-resolved-multiresolution-phase-force-identity.json.gz",
      "state": "ABSENT"
    },
    "expectedSidecar": {
      "path": "90_候选工作区/current/A8_二维特征开放边界实验后端/验证与复现/artifacts/a8-brinkman-cycle-resolved-multiresolution-phase-force-identity.sha256",
      "state": "ABSENT"
    },
    "partialArtifacts": [],
    "artifactAsserterExecuted": false
  },
  "scientificBoundary": {
    "scientificPayloadInspected": false,
    "scientificConclusion": "NONE",
    "recoverableScientificBytes": 0,
    "creditableCompletedHw1Cases": 0,
    "partialProgressCredit": 0
  },
  "routeLocks": {
    "legacyFullSerialRerunAuthorized": false,
    "checkpointResumeAuthorized": false,
    "oldWorktreeReuseAuthorized": false,
    "mixedProvenanceAuthorized": false,
    "nextGate": "G1-AND-HW1-V2-FOUNDATION"
  },
  "validation": {
    "r0HashesRecomputedFromEntities": true,
    "oldWorktreeReadOnlyChecksPerformed": true,
    "scientificPayloadReadPerformed": false,
    "networkFetchPerformedAgainstOldWorktree": false,
    "heavyProbePerformed": false
  }
}
